,Title,Desc,Type,BodyPart,Equipment,Level,Rating,RatingDesc
1400,Total Fitness Hamstring Slide,"The hamstring slide is a bodyweight exercise targeting the hamstrings. Lying supine on a smooth surface, you bend your knees to pull both heels toward you. The sliding action requires a pad, cloth, or furniture sliders under the heel. These are considered more difficult than exercise ball hamstring curls, and are a great primer movement before heavy squats or deadlifts, or as an accessory movement later in a lower-body workout.",Strength,Hamstrings,Body Only,Intermediate,,
1401,30 Legs Walking Lunge,,Strength,Hamstrings,Body Only,Intermediate,,
1402,Glute ham raise-,"The glute ham raise is an exercise targeting the glutes and hamstrings on a GHD, or glute ham developer bench. The unassisted version of the movement requires serious hamstring strength, so it is more common to see versions that use a band or PVC pipe for assistance. It is commonly performed as an accessory movement for heavy barbell lifts. While a single rep may be a struggle at first, with time, strong athletes can build up to doing them for 8-12 reps per set.",Strength,Hamstrings,None,Beginner,9.1,Average
1403,Lying hamstring stretch with band,"The lying hamstring stretch with band is a simple way to stretch a chronically tight muscle group of the lower body. It is common in stretching and yoga classes but can also be performed individually as part of a warm-up, paired with movements in a workout, or as part of a cool-down or recovery strategy.",Stretching,Hamstrings,None,Beginner,5.9,Average
1404,Upper Back-Leg Grab,,Stretching,Hamstrings,None,Beginner,5.4,Average
1405,Seated Hamstring,,Stretching,Hamstrings,None,Beginner,5.3,Average
1406,Alternating lunge jump,"The alternating lunge jump is an explosive bodyweight exercise that targets the lower-body muscles, including the quads, glutes, and hamstrings. It can be performed for time or reps in power training, and is also effective in any fat-loss or athleticism-focused workout.",Stretching,Hamstrings,None,Beginner,4.2,Average
1407,Runner's Stretch,,Stretching,Hamstrings,None,Intermediate,3.6,Average
1408,Exercise ball leg curl,"The exercise ball leg curl is an exercise targeting the hamstrings. In particular, it targets the knee flexion function of the hamstrings, as opposed to deadlift variations, which target the other hamstring function, hip flexion. Many lifters opt for this exercise when they don't have access to a lying leg curl machine, but it is worth considering even if you already do machine curls.",Strength,Hamstrings,Exercise Ball,Intermediate,8.8,Average
1409,Ball Hamstring Hat Trick,"The exercise ball leg curl is an exercise targeting the hamstrings. In particular, it targets the knee flexion function of the hamstrings, as opposed to deadlift variations, which target the other hamstring function, hip flexion. Many lifters opt for this exercise when they don’t have access to a lying leg curl machine, but it is worth considering even if you already do machine curls.",Strength,Hamstrings,Exercise Ball,Intermediate,,
1410,Band-assisted pull-up,"The band-assisted pull-up is a variation of the pull-up exercise in which the reps are performed with an elastic band looped around the feet or knees. This reduces weight and resistance at the bottom of the rep, while increasing it toward the top. Like other pull-up variations, it builds strength and muscle in the upper back, biceps, and core, and is often used as a way to help people boost their pull-up numbers or perform their first rep.",Strength,Lats,Bands,Intermediate,7.6,Average
1411,Assisted Chin-Up,"The reverse-grip chin-up is a variation of the pull-up exercise in which the reps are performed with the palms facing toward the body, in an underhand position, with a band looped around the feet or knees. This reduces weight and resistance at the bottom of the rep, while increasing it toward the top. Like other pull-up variations, it builds strength and muscle in the upper back, biceps, and core, but it utilizes the biceps slightly more than overhand band-assisted pull-ups.",Strength,Lats,Bands,Beginner,0.0,Average
1412,UN Band Assisted Pull-up Pronated,,Strength,Lats,Bands,Intermediate,,
1413,UN Band Assisted Pull-up Neutral,,Strength,Lats,Bands,Intermediate,,
1414,UN Band Assisted Pull-up Supinated,,Strength,Lats,Bands,Intermediate,,
1415,FYR2 Monster Band Face-Pull Hold,,Strength,Lats,Bands,Intermediate,,
1416,Single-arm band low row,"The single-arm band low row is a single-arm row variation utilizing a band for resistance that is anchored low. It targets the muscles of the middle back, like the lats (latissimus dorsi) and rhomboids, but also the core. It is usually performed for moderate to high reps, at least 8-15 reps per set, in the later stages of a back or upper-body workout.",Strength,Lats,Bands,Intermediate,,
1417,Latissimus dorsi SMR,"Latissimus dorsi self-myofascial release (SMR) is a self-administered soft-tissue treatment for the upper body, usually using a foam roller, lacrosse ball, or other ""trigger point"" massage tool. By applying pressure strategically to the lat muscles of the mid back, some people find they can cause this often painful and tight area to relax or ""release."" Latissimus dorsi SMR is often accompanied by SMR on the pectorals or rhomboids, or by stretches that target the lats.",Stretching,Lats,Foam Roll,Intermediate,4.7,Average
1418,Bent-arm barbell pull-over,"The bent-arm barbell pull-over was a staple exercise of the ""Golden Era"" of bodybuilding and a favorite of Arnold Schwarzenegger himself. Done properly, the exercise targets the pecs, lats, and serratus anterior muscles. Old-school bodybuilders would perform them with light weights for sets of 20 between sets of heavy 20-rep squats, but pull-overs are more popular today in moderate rep ranges, such as 8-12 reps per set, as part of an upper-body workout.",Strength,Lats,Barbell,Intermediate,8.0,Average
1419,Barbell pull-over to press,"The barbell pull-over to press is a complex that combines two popular exercises into one sequence that works much of the upper body, particularly the chest, triceps, and serratus anterior muscles. It is commonly performed with an EZ-bar, but can also be performed with a straight bar or neutral-grip bar. Because the pull-over will determine the amount of weight you can use, this movement is usually performed for moderate to high reps, such as 8-12 reps per set or more, as part of the upper-body portion of a workout.",Strength,Lats,Barbell,Beginner,0.0,
1420,Single-arm barbell bent-over row,"The single-arm barbell bent-over row is a barbell exercise focused on the muscles of the middle back, such as the lats (latissimus dorsi) and rhomboids. It also targets the biceps and grip. If the loose end of the barbell moves around, it can be secured by placing it in the corner of a room.",Strength,Lats,Barbell,Intermediate,,
1421,Reverse Barbell Row,,Strength,Lats,Barbell,Intermediate,,
1422,Side kick-through to kettlebell high pull,"The side kick-through to kettlebell high pull is a combination of a popular bodyweight exercise and an explosive kettlebell movement. Between them, the pairing targets the traps, shoulders, core, hips, hamstrings, and glutes. This combination can be performed for time or for reps, often as circuit-style training for conditioning or fat loss.",Strength,Lats,Kettlebells,Intermediate,,
1423,FYR2 Alternating Kettlebell Snatch,,Strength,Lats,Kettlebells,Intermediate,,
1424,FYR2 Alternating Kettlebell Swing,,Strength,Lats,Kettlebells,Intermediate,,
1425,FYR2 American Kettlebell Swing,,Strength,Lats,Kettlebells,Intermediate,,
1426,FYR2 Double-Kettlebell Standing Clean,,Strength,Lats,Kettlebells,Intermediate,,
1427,FYR2 Kettlebell Swing High Pull,,Strength,Lats,Kettlebells,Intermediate,,
1428,FYR2 Kettlebell Swing-Clean-Press Combo,,Strength,Lats,Kettlebells,Intermediate,,
1429,FYR2 Kettlebell Swing-Clean-Press-Row Combo,,Strength,Lats,Kettlebells,Intermediate,,
1430,FYR2 Single-Arm Kettlebell Clean,,Strength,Lats,Kettlebells,Intermediate,,
1431,FYR2 Single-Arm Kettlebell Swing,,Strength,Lats,Kettlebells,Intermediate,,
